id_variabel,nama_variabel,alias,konsep,definisi,referensi_pemilihan,referensi_waktu,ukuran,satuan,tipe_data,klasifikasi_isian,aturan_validasi,kalimat_pertanyaan,is_publik
1,Harga Eceran Barang dan Jasa di Minggu/Bulan Sebelumnya,B4R6,Harga Eceran,Harga yang terjadi antara penjual (pedagang eceran) dan pembeli (konsumen) di minggu/bulan sebelumnya. Harga eceran yang dikumpulkan terdiri dari 847 jenis barang dan jasa setiap bulan yang dikelompokkan berdasarkan 11 (sebelas) kelompok pengeluaran yaitu 1. Makanan Minuman dan Tembakau; 2. Pakaian dan Alas Kaki; 3. Perumahan Air Listrik Gas dan Bahan Bakar Rumah Tangga; 4. Perlengkapan Peralatan dan Pemeliharaan Rutin Rumah Tangga; 5. Kesehatan; 6. Transportasi; 7. Informasi Komunikasi dan Jasa Keuangan; 8. Rekreasi Olahraga dan Budaya; 9. Pendidikan; 10. Penyediaan Makanan dan Minuman/Restoran; 11. Perawatan Pribadi dan Jasa Lainnya.,,Minggu/bulan sebelumnya atau bulan/minggu ke (n-1),Nilai,Rupiah,Integer,,Wajib terisi,Harga Sebelum,FALSE
2,Harga Eceran Barang dan Jasa di Minggu/Bulan Berjalan,B4R7,Harga Eceran,Harga yang terjadi antara penjual (pedagang eceran) dan pembeli (konsumen) pada minggu/bulan berjalan/saat pencacahan. Harga eceran yang dikumpulkan terdiri dari 847 jenis barang dan jasa setiap bulan yang dikelompokkan berdasarkan 11 (sebelas) kelompok pengeluaran yaitu 1. Makanan Minuman dan Tembakau; 2. Pakaian dan Alas Kaki; 3. Perumahan Air Listrik Gas dan Bahan Bakar Rumah Tangga; 4. Perlengkapan Peralatan dan Pemeliharaan Rutin Rumah Tangga; 5. Kesehatan; 6. Transportasi; 7. Informasi Komunikasi dan Jasa Keuangan; 8. Rekreasi Olahraga dan Budaya; 9. Pendidikan; 10. Penyediaan Makanan dan Minuman/Restoran; 11. Perawatan Pribadi dan Jasa Lainnya.,,Minggu/bulan sekarang/saat pencacahan atau minggu/bulan ke-(n),Nilai,Rupiah,Integer,,Peringatan agar cek ulang data ketika terdapat perubahan harga yang ekstrem dibandingkan variabel harga di minggu/bulan sebelumnya yaitu naik/turun lebih dari 50%,Harga Sekarang,TRUE
3,Nilai/harga sewa alat berat konstruksi,VHKK2022.SAU B5R4-B5R7,Nilai/harga sewa alat berat konstruksi,Harga yang terjadi ketika seseorang/institusi/organisasi menyewa alat-alat berat yang digunakan untuk kegiatan konstruksi dalam periode tertentu (1 bulan atau 200 jam). Harga sewa merupakan harga sewa murni alat tanpa biaya mobilisasi alat biaya jasa operator dan biaya bahan bakar. Umur alat berat yang dicacah adalah yang berumur maksimal 8 tahun,,Tanggal 20-30 bulan pertama setiap triwulan,,,Integer,1. Triwulan 1; 2. Triwulan 2; 3. Triwulan 3; 4. Triwulan 4,Harus terisi apabila kolom satuan/unit terisi,Nilai Sewa per Satuan/Unit,FALSE
4,Nilai Upah Jasa Konstruksi per satuan/unit (OH atau Titik),VHKK2022.SAU B6R3-B6R6,Nilai Upah Jasa Konstruksi per satuan/unit,Nilai upah/balas jasa yang diterima oleh pekerja jasa konstruksi per satuan/unit (OH atau Titik) pada kondisi triwulanan (pekerja konstruksi yang dimaksud bukan pekerja konstruksi perorangan),,Tanggal 20-30 bulan pertama setiap triwulan,,,Integer,1. Triwulan 1; 2. Triwulan 2; 3. Triwulan 3; 4. Triwulan 4,Tidak boleh minus,Upah per Satuan/Unit,FALSE
5,Harga komoditas barang konstruksi,VHKK2022.MNPL B4R10-B4R13; VHKK2022.MP B4R8-B4R11; VHKK2022.SAU B4R5-B4R8,Harga komoditas barang konstruksi,Harga komoditas barang konstruksi yang terdiri dari material natural dan produk lanjutannya; material pabrikan; dan komoditas aspal untuk setiap satuan penjualannya (satuan standar/setempat). Harga yang dicatat merupakan harga transaksi pada level pedagang grosir produsen pedagang campuran atau pedagang eceran yang dikumpulkan triwulanan,,Tanggal 20-30 bulan pertama setiap triwulan,,,Integer,1. Triwulan 1; 2. Triwulan 2; 3. Triwulan 3; 4. Triwulan 4,Harus terisi apabila salah satu kolom dari komoditas barang kualitas barang merek dan ukuran stuan setempat terisi,Harga per Satuan Setempat,FALSE